{
  "format": 2,
  "name": "MultiWellPlant",
  "modules": {
    "producers": {
      "type": "ModuleList",
      "modules": {
        "0": {
          "type": "ModuleDict",
          "modules": {
            "reservoir": {
              "type": "ProductionReservoir",
              "params": {}
            },
            "well": {
              "type": "ProductionWell",
              "params": {}
            },
            "esp": {
              "type": "ESP",
              "params": {}
            },
            "riser": {
              "type": "ProductionWell",
              "params": {}
            }
          }
        },
        "1": {
          "type": "ModuleDict",
          "modules": {
            "reservoir": {
              "type": "ProductionReservoir",
              "params": {}
            },
            "well": {
              "type": "ProductionWell",
              "params": {}
            },
            "esp": {
              "type": "ESP",
              "params": {}
            },
            "riser": {
              "type": "ProductionWell",
              "params": {}
            }
          }
        }
      }
    },
    "mixers": {
      "type": "ModuleList",
      "modules": {
        "0": {
          "type": "Mixer",
          "params": {}
        }
      }
    },
    "splitters": {
      "type": "ModuleList",
      "modules": {}
    },
    "injectors": {
      "type": "ModuleList",
      "modules": {
        "0": {
          "type": "ModuleDict",
          "modules": {
            "well": {
              "type": "InjectionWell",
              "params": {}
            },
            "sink": {
              "type": "InjectionReservoir",
              "params": {}
            }
          }
        }
      }
    }
  },
  "connections": [
    {
      "source": "producers.0.reservoir.sandface_out",
      "target": "producers.0.well.bottom_in"
    },
    {
      "source": "producers.0.well.wellhead_out",
      "target": "producers.0.esp.fluid_in"
    },
    {
      "source": "producers.0.esp.fluid_out",
      "target": "producers.0.riser.bottom_in"
    },
    {
      "source": "producers.1.reservoir.sandface_out",
      "target": "producers.1.well.bottom_in"
    },
    {
      "source": "producers.1.well.wellhead_out",
      "target": "producers.1.esp.fluid_in"
    },
    {
      "source": "producers.1.esp.fluid_out",
      "target": "producers.1.riser.bottom_in"
    },
    {
      "source": "producers.0.riser.wellhead_out",
      "target": "mixers.0.branch1_in"
    },
    {
      "source": "producers.1.riser.wellhead_out",
      "target": "mixers.0.branch2_in"
    },
    {
      "source": "injectors.0.well.bottom_out",
      "target": "injectors.0.sink.sandface_in"
    }
  ],
  "inlets": {
    "return_in": "injectors.0.well.wellhead_in"
  },
  "outlets": {
    "supply_out": "mixers.0.fluid_out"
  },
  "outputs": {
    "electricity": {
      "sum": "electricity"
    },
    "heat_loss": {
      "sum": "heat_loss"
    },
    "supply_out_T": {
      "of": "mixers.0.fluid_out_T"
    }
  },
  "bindings": {},
  "param_history": {}
}
